{
  "id": "agsvpt",
  "name": "末日种子库",
  "domain": "https://www.agsvpt.com",
  "encoding": "UTF-8",
  "public": false,
  "html": {
    "search": {
      "paths": [
        {
          "path": "torrents.php",
          "method": "get"
        }
      ],
      "params": {
        "search": "{keyword}"
      },
      "batch": {
        "delimiter": " ",
        "space_replace": "_"
      }
    },
    "category": {
      "movie": [
        {
          "id": 401,
          "cat": "Movies",
          "desc": "Movies(电影)"
        }
      ],
      "tv": [
        {
          "id": 402,
          "cat": "TV",
          "desc": "TV Series(电视剧)"
        },
        {
          "id": 405,
          "cat": "TV/Anime",
          "desc": "Anime(动漫)"
        },
        {
          "id": 404,
          "cat": "TV/Documentary",
          "desc": "Documentaries(纪录片)"
        }
      ]
    },
    "torrents": {
      "list": {
        "selector": "table.torrents > tr:has(\"table.torrentname\")"
      },
      "fields": {
        "id": {
          "selector": "a[href*=\"details.php?id=\"]",
          "attribute": "href",
          "filters": [
            {
              "name": "re_search",
              "args": [
                "\\d+",
                0
              ]
            }
          ]
        },
        "category": {
          "selector": "a[href*=\"?cat=\"]",
          "attribute": "href",
          "filters": [
            {
              "name": "querystring",
              "args": "cat"
            }
          ]
        },
        "title": {
          "selector": "td.rowfollow:nth-child(2) > table.torrentname > tr > td:nth-child(2) > a > b"
        },
        "details": {
          "selector": "a[href*=\"details.php?id=\"]",
          "attribute": "href"
        },
        "poster": {
          "selector": "img[data-src]",
          "attribute": "data-src"
        },
        "download": {
          "selector": "a[href*=\"download.php?id=\"]",
          "attribute": "href"
        },
        "size": {
          "selector": "td.rowfollow:nth-child(5)"
        },
        "grabs": {
          "selector": "td.rowfollow:nth-child(8)"
        },
        "seeders": {
          "selector": "td.rowfollow:nth-child(6)"
        },
        "leechers": {
          "selector": "td.rowfollow:nth-child(7)"
        },
        "date_elapsed": {
          "selector": "td.rowfollow:nth-child(4)",
          "optional": true
        },
        "date_added": {
          "selector": "td.rowfollow:nth-child(4)",
          "optional": true
        },
        "date": {
          "text": "{% if fields['date_elapsed'] or fields['date_added'] %}{{ fields['date_elapsed'] if fields['date_elapsed'] else fields['date_added'] }}{% else %}now{% endif %}"

        },
        "downloadvolumefactor": {
          "case": {
            "img.pro_free": 0,
            "img.pro_free2up": 0,
            "img.pro_50pctdown": 0.5,
            "img.pro_50pctdown2up": 0.5,
            "img.pro_30pctdown": 0.3,
            "*": 1
          }
        },
        "uploadvolumefactor": {
          "case": {
            "img.pro_50pctdown2up": 2,
            "img.pro_free2up": 2,
            "img.pro_2up": 2,
            "*": 1
          }
        },
        "free_deadline": {
          "default_value": "{% if fields['downloadvolumefactor']==0 %}{{max_time}}{% endif%}",
          "default_value_format": "%Y-%m-%d %H:%M:%S.%f",
          "selector": "div > b > span[title]",
          "attribute": "td.rowfollow:nth-child(2) > table.torrentname > tr > td:nth-child(2) > font > span"

        },
        "description": {
          "selector": "td.rowfollow:nth-child(2) > table.torrentname > tr > td:nth-child(2)",
          "remove": "img,a,b,span,font"
        },
        "labels": {
          "selector": "td.rowfollow:nth-child(2) > table.torrentname > tr > td:nth-child(2) > div.torrent_title_desc > span"
        }
      }
    },
    "conf": {
      "FREE": [
        "//h1[@id='top']/b/font[@class='free']"
      ],
      "2XFREE": [
        "//h1[@id='top']/img[@class='hitandrun']"
      ],
      "HR": [
        "//h1[@id='top']/img[@class='hitandrun']"
      ],
      "PEER_COUNT": [
        "//div[@id='peercount']/b[1]"
      ]
    }
  },
  "detail_page_url": "/details.php?id={tid}"
}