{
  "id": "tmpt",
  "name": "唐门",
  "domain": "https://tmpt.top",
  "encoding": "UTF-8",
  "public": false,
  "html": {
    "search": {
      "paths": [
        {
          "path": "torrents.php",
          "method": "get"
        }
      ],
      "params": {
        "search": "{keyword}"
      },
      "batch": {
        "delimiter": " ",
        "space_replace": "_"
      }
    },
    "category": {
      "movie": [
        {
          "id": 401,
          "cat": "Movies",
          "desc": "电影/Movies"
        }
      ],
      "tv": [
        {
          "id": 402,
          "cat": "TV",
          "desc": "连续剧/TV-Series"
        },
        {
          "id": 403,
          "cat": "TV",
          "desc": "综艺/TV-Show"
        },
        {
          "id": 404,
          "cat": "TV/Documentary",
          "desc": "纪录片/Documentary"
        },
        {
          "id": 405,
          "cat": "TV/Anime",
          "desc": "动漫/Animation"
        }
      ]
    },
    "torrents": {
      "list": {
        "selector": "table.torrents > tr:has(\"table.torrentname\")"
      },
      "fields": {
        "id": {
          "selector": "a[href*=\"details.php?id=\"]",
          "attribute": "href",
          "filters": [
            {
              "name": "re_search",
              "args": [
                "\\d+",
                0
              ]
            }
          ]
        },
        "category": {
          "selector": "a[href*=\"?cat=\"]",
          "attribute": "href",
          "filters": [
            {
              "name": "querystring",
              "args": "cat"
            }
          ]
        },
        "title_default": {
          "selector": "a[href*=\"details.php?id=\"]"
        },
        "title_optional": {
          "optional": true,
          "selector": "a[title][href*=\"details.php?id=\"]",
          "attribute": "title"
        },
        "title": {
          "text": "{% if fields['title_optional'] %}{{ fields['title_optional'] }}{% else %}{{ fields['title_default'] }}{% endif %}"
        },
        "details": {
          "selector": "a[href*=\"details.php?id=\"]",
          "attribute": "href"
        },
        "download": {
          "selector": "a[href*=\"download.php?id=\"]",
          "attribute": "href"
        },
        "size": {
          "selector": "td:nth-child(5)"
        },
        "grabs": {
          "selector": "td:nth-child(8)"
        },
        "seeders": {
          "selector": "td:nth-child(6)"
        },
        "leechers": {
          "selector": "td:nth-child(7)"
        },
        "date_elapsed": {
          "selector": "td:nth-child(4) > span",
          "optional": true
        },
        "date_added": {
          "selector": "td:nth-child(4) > span",
          "attribute": "title",
          "optional": true
        },
        "date": {
          "text": "{% if fields['date_elapsed'] or fields['date_added'] %}{{ fields['date_elapsed'] if fields['date_elapsed'] else fields['date_added'] }}{% else %}now{% endif %}"

        },
        "downloadvolumefactor": {
          "case": {
            "img.pro_free": 0,
            "img.pro_free2up": 0,
            "img.pro_50pctdown": 0.5,
            "img.pro_50pctdown2up": 0.5,
            "img.pro_30pctdown": 0.3,
            "*": 1
          }
        },
        "uploadvolumefactor": {
          "case": {
            "img.pro_50pctdown2up": 2,
            "img.pro_free2up": 2,
            "img.pro_2up": 2,
            "*": 1
          }
        },
        "free_deadline": {
          "default_value": "{% if fields['downloadvolumefactor']==0 %}{{max_time}}{% endif%}",
          "default_value_format": "%Y-%m-%d %H:%M:%S.%f",
          "selector": "td[class=\"embedded\"] > b > span[title]",
          "attribute": "title"

        },
        "description": {
          "selector": "table.torrentname > tr > td.embedded:nth-child(2)",
          "remove": "span,a,img,font,b",
          "contents": -1
        },
        "labels": {
          "selector": "table.torrentname > tr > td.embedded > span[title=\"\"]"
        }
      }
    },
    "conf": {
      "FREE": [
        "//h1[@id='top']/b/font[@class='free']"
      ],
      "2XFREE": [
        "//h1[@id='top']/b/font[@class='twoupfree']"
      ],
      "HR": [],
      "PEER_COUNT": [
        "//div[@id='peercount']/b[1]"
      ]
    }
  },
  "detail_page_url": "/details.php?id={tid}"
}